Reason;File;Name;Auth;Year;;
Noneg;omahony2014.pdf;the influence of disease risk on the optimal time interval between screens for the early detection of cancer a mathematical approach;OMahony JF, van Rosmalen J, Mushkudiani NA, Goudsmit FW, Eijkemans MJ, Heijnsdijk EA, Steyerberg EW, Habbema JD;2014;;
Noneg;chauvin2013.pdf;The influence of waiting times on cost-effectiveness: a case study of colorectal cancer mass screening;Chauvin P, Josselin JM, Heresbach D;2013;;
Anton;wu2012.pdf;The Lead Time Distribution When Lifetime is Subject to Competing Risks in Cancer Screening;Wu D, Kafadar K, Rosner GL, Broemeling LD;2012;;
Anton;schillerfruehwirth2017.pdf;the long-term effectiveness and cost-effectiveness of organized versus opportunistic screening for breast cancer in austria;Irmgard Schiller-Fruehwirth, Beate Jahn, Patrick Einzinger,Gunther Zauner,Christoph Urach, Uwe Siebert;2017;;
Noneg;loeve1999.pdf;the miscan-colon simulation model for the evaluation of colorectal cancer screening;Loeve F, Boer R, van Oortmarssen GJ, van Ballegooijen M, Habbema JDF;1999;;
Anton;muhlberger2015.pdf;the oncotyrol prostate cancer outcome and policy model effect of prevalence assumptions on the benefit-harm balance of screening;Nikolai Muehlberger, Christina Kurzthaler, Rowan Iskandar,Murray D Krahn, Karen E Bremner, Willi Oberaigner, Helmut Klocker, Wolfgang Horninger, Annette Conrads-Frank, Gaby Sroczynski, Siebert Uwe;2015;;
q12;sinanovic2009.pdf;the potential cost-effectiveness of adding a human papillomavirus vaccine to the cervical cancer screening programme in south africa;Sinanovic E, Moodley J, Barone, Mall S, Cleary S, Harries J;2009;;
Noneg;naber2016.pdf;the potential harms of primary human papillomavirus screening in over-screened women a microsimulation study;Naber SK, de Kok IM, Matthijsse SM, van Ballegooijen M;2016;;
Anton;korostil2014.pdf;The potential impact of HPV-16 reactivation on prevalence in older Australians;Korostil IA, Regan DG;2014;;
Noneg;canfell2004.pdf;the predicted effect of changes in cervical screening practice in the uk results from a modelling study;Canfell K, Barnabas R, Patnick J, Beral V;2004;;
Noneg;castro2005.pdf;the relation of breast cancer staging to screening protocol compliance a computer simulation study;Castro F, Carter KJ, Kessler E, Erickson BA, Kseibi SA;2005;;
Anton;matthijsse2015.pdf;the role of acquired immunity in the spread of human papillomavirus hpv explorations with a microsimulation model;Matthijsse SM, van Rosmalen J, Hontelez JA, Bakker R, de Kok IM, van Ballegooijen M, de Vlas SJ;2015;;
Noneg;siddiqui2011.pdf;the role of physician reminders in faecal occult blood testing for colorectal cancer screening;Muhammed Rafay Sameem Siddiqui, Muhammad Shafiq Sajid,Kamran Khatri, Bipul Kanri, Elizabeth Cheek, Mirza Khurrum Baig;2011;;
q12;lgj008.pdf;the spectrum population model of the impact of screening and treatment on us breast cancer trends from 1975 to 2000 principles and practice of the model methods;Mandelblatt J, Schechter CB, Lawrence W, Yi B, Cullen J;2006;;
Noneg;lgj010.pdf;the university of rochester model of breast cancer detection and survival;Hanin LG, Miller A, Zorin AV, Yakovlev AY;2006;;
q12;feuer2004.pdf;The use of modeling to understand the impact of screening on US mortality: examples from mammography and PSA testing;Feuer EJ, Etzioni R, Cronin KA, Mariotto A;2004;;
Noneg;older.pdf;the value of colonoscopic colorectal cancer screening of adults aged 50 to 64 years;Kathryn Fitch, Pyenson Bruce, Blumen Helen, Weisman Thomas, Small Art;2015;;
Anton;burger2014.pdf;the value of improving failures within a cervical cancer screening program an example from norway;Burger EA, Kim JJ;2014;;
q12;sharma2015.pdf;The value of male human papillomavirus vaccination in preventing cervical cancer and genital warts in a low-resource setting;Sharma M, Sy S, Kim JJ;2015;;
Noneg;lgj007.pdf;the wisconsin breast cancer epidemiology simulation model;Dennis G Fryback, Natasha K Stout, Marjorie A Rosenberg, Amy Trentham-Dietz,Vipat Kuruchittham, Patrick L Remington;2006;;
Noneg;10.7326@0003-4819-156-9-201205010-00002.pdf;tipping the balance of benefits and harms to favor screening mammography starting at age 40 years a comparative modeling study of risk;van Ravesteyn NT, Miglioretti DL, Stout NK, Lee SJ, Schechter CB, Buist DS, Huang H, Heijnsdijk EA, Trentham-Dietz A, Alagoz O, Near AM, Kerlikowske K, Nelson HD, Mandelblatt JS, de Koning HJ;2012;;
Noneg;campos2017 (1).pdf;The Cost-Effectiveness of Visual Triage of Human Papillomavirus-Positive Women in Three Low- and Middle-Income Countries;Nicole G Campos, Jose Jeronimo, Vivien Tsu, Philip E Castle, Mercy Mvundura, Jane J Kima;2017;;
Noneg;jgi_05076.pdf;toward optimal screening strategies for older women costs benefits and harms of breast cancer screening by age biology and health status;Jeanne S Mandelblatt, Clyde B Schechter, K Robin Yabroff,William Lawrence, James Dignam, Martine Extermann,Sarah Fox, Gretchen Orosz, Rebecca Silliman,Jennifer Cullen, Lodovico Balducci;2005;;
Anton;choi2010.pdf;transmission dynamic modelling of the impact of human papillomavirus vaccination in the united kingdom;Choi YH, Jit M, Gay N, Cox A, Garnett GP, Edmunds WJ;2010;;
Noneg;bergstrm1999.pdf;trends in cancer of the cervix uteri in sweden following cytological screening;Bergstrom R, Sparen P, Adami H-O;1999;;
Anton;barnett2017.pdf;two-stage biomarker protocols for improving the precision of early detection of prostate cancer;Christine L Barnett, Scott A Tomlins, Daniel J Underwood,John T Wei, Todd M Morgan, James E Montie, Brian T Denton ;2017;;
Noneg;campbell2016.pdf;understanding the effects of competition for constrained colonoscopy services with the introduction of population-level colorectal cancer screening a discrete event simulation model;Leslie Anne Campbell, John T Blake, George Kephart,Eva Grunfeld, Donald MacIntosh, ;2016;;
q12;beaber2015.pdf;Unifying Screening Processes Within the PROSPR Consortium: A Conceptual Model for Breast, Cervical,and Colorectal Cancer Screening;Beaber EF, Kim JJ, Schapira MM, Tosteson AN, Zauber AG, Geiger AM, Kamineni A, Weaver DL, Tiro JA Population-based Research Optimizing Screening through Personalized Regimens Consortium;2015;;
Noneg;duffy2009.pdf;Use of lung cancer risk models in planning research and service programs in CT screening for lung cancer;Duffy SW, Raji OY, Agbaje OF, Allgood PC, Cassidy A, Field JK;2009;;
Noneg;ramsey2000.pdf;SIMULATION MODELING  OF OUTCOMES AND COST-EFFECTIVENESS ;Ramsey SD, McIntosh M, Etzioni R, Urban N;2000;;
Noneg;ramos2005.pdf;Use of risk projection models to estimate mortality and incidence from radiation-induced breast cancer in screening programs;M Ramos, S Ferrer, J I Villaescusa, G Verdu, M D Salas, M D Cuevas;2005;;
Noneg;carney2014.pdf;using computational modeling to assess the impact of clinical decision support on cancer screening improvement strategies within the community health centers;Jay Timothy Carney, Morgan Geoffrey P, Jones Josette, Anna M McDaniel, Michael Weaver, Bryan Weiner, David A Haggstrom ;2014;;
Noneg;sharp2013.pdf;Using resource modelling to inform decision making and service planning: the case of colorectal cancer screening in Ireland;Linda Sharp, Lesley Tilson, Sophie Whyte, Alan O Ceilleachair, Cathal Walsh, Cara Usher, Paul Tappenden,James Chilcott, Anthony Staines, Michael Barry, Harry Comber;2013;;
Noneg;taghipour2016.pdf;using simulation to model and validate invasive breast cancer progression in women in the study and control groups of the canadian national breast screening studies i and ii;Taghipour S, Caudrelier LN, Miller AB, Harvey B;2016;;
Noneg;mclay2010.pdf;using simulation-optimization to construct screening strategies for cervical cancer;Laura A McLay, Christodoulos Foufoulides, Jason R W Merrick;2010;;
Noneg;coldman2015.pdf;using the cancer risk management model to evaluate colorectal cancer screening options for canada;Coldman A J, Phillips N, Brisson J, Flanagan W, Wolfson M, Nadeau C, Fitzgerald N, Miller A B;2013;;
Anton;rutter2016.pdf;validation of models used to inform colorectal cancer screening guidelines accuracy and implications;Carolyn M Rutter, Amy B Knudsen, Tracey L Marsh,V Paul Doria-Rose, Eric Johnson, Chester Pabiniak,Karen M Kuntz, Marjolein van Ballegooijen,Ann G Zauber, Iris Lansdorp-Vogelaar;2016;;
Anton;nevalainen2017.pdf;what explains the differences between centres in the european screening trial a simulation study;Jaakko Nevalainen, Ulf-Hkan Stenman, Teuvo L Tammela, Monique Roobol,Sigrid Carlsson, Kirsi Talala, Fritz H Schrder, Anssi Auvinen;2017;;
Noneg;lynge2006.pdf;What happens when organization of cervical cancer screening is delayed or stopped?;Lynge E, Clausen LB, Guignard R, Poll P;2006;;
Noneg;document(1).pdf;What is the most cost-effective screening regimen for colon cancer?;Susan Griffith, Kevin Y Kane;2001;;
q12;mandelblatt2013.pdf;which strategies reduce breast cancer mortality most;Jeanne Mandelblatt, Nicolien van Ravesteyn, Clyde Schechter, Yaojen Chang, An-Tsun Huang, Aimee M Near, Harry de Koning, Ahmedin Jemal ;2013;;
Noneg;belkar2005.pdf;why worry about awareness in choice problems econometric analysis of screening for cervical cancer;Belkar R, Fiebig DG, Haas M, Viney R;2005;;
FromReview;mandelblatt2016.pdf;Collaborative Modeling of the Benefits and Harms Associated With Different U.S. Breast Cancer Screening Strategies;Jeanne S Mandelblatt, Natasha K Stout, Clyde B Schechter, Jeroen J van den Broek, Diana L Miglioretti, Martin Krapcho, Amy Trentham-Dietz, Diego Munoz, Sandra J Lee, Donald A Berry, Nicolien T van Ravesteyn, Oguzhan Alagoz, Karla Kerlikowske, Anna NA Tosteson, Aimee M Near, Amanda Hoeffken, Yaojen Chang, Eveline A Heijnsdijk, Gary Chisholm, Xuelin Huang, Hui Huang, Mehmet Ali Ergun, Ronald Gangnon, Brian L Sprague, Sylvia Plevritis, Eric Feuer, Harry J de Koning, Kathleen A Cronin;2016;;
Noneg;loeve2000.pdf;Endoscopic Colorectal Cancer Screening: a Cost-Saving Analysis;Franka Loeve, Martin L Brown, Rob Boer, Marjolein van Ballegooijen, Gerritt J van Oortmarssen, J Dik F Habbema;2000;;
Anton;nihms331310.pdf;Long-term Projections of the Number Needed to Screen and Additional Number Needed to Treat in Prostate Cancer Screening;Roman Gulati, Angela B Mariotto, Shu Chen, John L Gore, Ruth Etzioni ;2011;;
Noneg;clries2013.pdf;Predicting the Change in Breast Cancer Deaths in Spain by 2019;Ramon Clries, Jose Miguel Martnez, Victor Moreno, Yutaka Yasui, Josepa Ribes, Josep Maria Borras;2013;;
Noneg;sawaya2003.pdf;Risk of Cervical Cancer Associated with Extending the Interval between Cervical-Cancer Screenings;George F Sawaya, K John McConnell, Shalini L Kulasingam, Herschel W Lawson,Karla Kerlikowske, Joy Melnikow, Nancy C Lee, Ginny Gildengorin,Evan R Myers, A Eugene Washington, ;2003;;
FromReview;lansdorpvogelaar2010.pdf;Stool DNA Testing to Screen for Colorectal Cancer in the Medicare Population;Iris Lansdorp-Vogelaar, Karen M Kuntz, Amy B Knudsen, Janneke A Wilschut, Ann G Zauber, Marjolein van Ballegooijen, ;2010;;
Noneg;campos2016.pdf;To Expand Coverage, or Increase Frequency: Quantifying the Tradeoffs between Equity and Efficiency Facing Cervical Cancer Screening Programs in Low-Resource Settings;Nicole G Campos, Vivien Tsu, Jose Jeronimo, Mercy Mvundura, Kyueun Lee, Jane J Kim;2016;;
Missed;campos2017_3.pdf;Evidence-based policy choices for efficient and equitable cervical cancer screening programs in low-resource settings.;Nicole G Campos, Vivien Tsu, Jose Jeronimo, Mercy Mvundura, Jane J Kim;2017;;
Missed;campos2017_4.pdf;Cost-effectiveness of HPV-based cervical cancer screening in the public health system in Nicaragua.;Nicole G Campos, Mercy Mvundura, Jose Jeronimo, Francesca Holme,Elisabeth Vodicka, Jane J Kim;2017;;
Missed;coldman2017_2.pdf;Simulating results from trials of sigmoidoscopy screening using the OncoSim microsimulation model;Andrew Coldman, Joy Pader, Cynthia Gauvreau,Saima Memon, Natalie Fitzgerald, William Flanagan, ClaudeNadeau, Craig Earle, Michael Wolfson, Anthony Miller, JasonLacombe;2017;;
Missed;cronin1998.pdf;Assessing uncertainty in microsimulation modelling with application to cancer screening interventions.;Kathleen A. Cronin, Julie M. Legler, Ruth D. Etzioni;1998;;
Missed;Dongfeng2012.pdf;INFERENCE OF LONG TERM EFFECTS AND OVERDIAGNOSIS IN PERIODIC CANCER SCREENING;Dongfeng Wu, Karen Kafadar, Gary L. Rosner;2012;;
Missed;Economic_Models_Workshop.pdf;economic models of colorectal cancer screening in average-risk adults: workshop summary;Michael Pignone, Louise Russell, Judith Wagner;2005;;
Missed;fett2001.pdf;Computer modelling of the Swedish two county trial of mammographic screening and trade offs between participation and screening interval;Fett, MJ;2001;;
Missed;fitzgerald2015.pdf;Eligibility for low-dose computerized tomography screening among asbestos-exposed individuals;Fitzgerald NR, Flanagan WM, Evans WK, Miller AB;2015;;
Missed;goede2015_2.pdf;Cost-Savings to Medicare From Pre-Medicare Colorectal Cancer Screening;Simon L Goede, Karen M Kuntz, Marjolein van Ballegooijen,Amy B Knudsen, Iris Lansdorp-Vogelaar, Florence K Tangka,David H Howard, Joseph Chin, Ann G Zauber, Laura C Seeff;2015;;
Missed;gulati2011_2.pdf;Long-term projections of the harm-benefit trade-off in prostate cancer screening are more favorable than previous short-term estimates;Roman Gulati, Angela B Mariotto, Shu Chen, John L Gore, Ruth Etzioni;2011;;
Missed;haug2014_2.pdf;Development of new non-invasive tests for colorectal cancer screening: the relevance of information on adenoma detection.;Haug U, Knudsen AB, Lansdorp-Vogelaar I, Kuntz KM;2014;;
Missed;imperiale2004.pdf;fecal dna versus fecal occult blood for colorectal-cancer screening in an average-risk population;Thomas F Imperiale, David F Ransohoff, Steven H Itzkowitz,Barry A Turnbull, Michael E Ross;2004;;
Missed;kamphuis2017.pdf;Effect of Cervical Cancer Screening Programs on Preterm Birth: A Decision and Cost-Effectiveness Analysis.;Esme I Kamphuis, Steffie K Naber, Noor A Danhof, J Dik F Habbema,Christianne J M de Groot, Ben W J Mol;2017;;
Missed;Koning2018.pdf;The efficacy of prostate-specific antigen screening: Impact of key components in the ERSPC and PLCO trials;Harry J de Koning, Roman Gulati, Sue M Moss, Jonas Hugosson, Paul F Pinsky, Christine D Berg, Anssi Auvinen, Gerald L Andriole, Monique J Roobol, E David Crawford, Vera Nelen, Maciej Kwiatkowski, Marco Zappa, Marcos Lujan, Arnauld Villers, Tiago M de Carvalho, Eric J Feuer, Alex Tsodikov, Angela B Mariotto, Eveline AM Heijnsdijk, Ruth Etzioni;2017;;
Missed;lam2004.pdf;The price of cancer screening;Lam CLK;2004;;
Missed;landy2017_2.pdf;What cervical screening is appropriate for women who have been vaccinated against high risk HPV? A simulation study;Rebecca Landy, Peter Windridge, Matthew S Gillman, Peter D Sasieni;2017;;
Missed;Lee2016_2.pdf;Cost Effectiveness of Colorectal Cancer Screening Interventions with Their Effects on Health Disparity Being Considered;Lee Kwang-Sig, Park Eun-Cheol;2016;;
Missed;mandelblatt2002_2.pdf;Costs and benefits of different strategies to screen for cervical cancer in less-developed countries;Jeanne S Mandelblatt, William F Lawrence, Lynne Gaffikin, Khunying Kobchitt Limpahayom, Pisake Lumbiganon, Suwanna Warakamin, Jason King, Bin Yi,Patricia Ringers, Paul D Blumenthal;2002;;
Missed;mandelblatt2004_2.pdf;Benefits and costs of interventions to improve breast cancer outcomes in African American women.;Jeanne S Mandelblatt, Clyde B Schechter, K Robin Yabroff, William Lawrence, James Dignam,Peter Muennig, Yoko Chavez, Jennifer Cullen, Marianne Fahs;2004;;
Missed;mandelblatt2011_2.pdf;Modeling the impact of population screening on breast cancer mortality in the United States;Jeanne S Mandelblatt, Kathleen A Cronin, Donald A Berry, Yaojen Chang, Harry J de Koning,Sandra J Lee, Sylvia K Plevritis, Clyde B Schechter, Natasha K Stout, Nicolien T van Ravesteyn,Marvin Zelen, Eric J Feuer;2011;;
Missed;marshall2001_2.pdf;Economic decision analysis model of screening for lung cancer;Marshall D, Simpson KN, Earle CC, Chu C-W;2001;;
Missed;neville2005.pdf;An alternative cost effectiveness analysis of ThinPrep in the Australian setting.;A Munro Neville, Michael A Quinn;2005;;
Missed;Perez2016.pdf;Estimation of the Cost-Effectiveness of Breast Cancer Screening Using Mammography in Mexico Through a Simulation;Ulloa-Perez E, Mohar-Betancourt A, Reynoso-Noveron N;2016;;
Missed;Ravesteyn2010.pdf;Race-specific impact of natural history, mammography screening, and adjuvant treatment on breast cancer mortality rates in the United States.;Nicolien T van Ravesteyn, Clyde B Schechter, Aimee M Near, Eveline AM Heijnsdijk, Michael A Stoto,Gerrit Draisma, Harry J de Koning, Jeanne S Mandelblatt;2010;;
Missed;roth2016_2.pdf;Economic Analysis of Prostate-Specific Antigen Screening and Selective Treatment Strategies;Joshua A Roth, Roman Gulati, John L Gore, Matthew R Cooperberg, Ruth Etzioni ;2016;;
Missed;shen1999.pdf;parametric estimation procedures for screening programmes: stable and nonstable disease models for multimodality case finding;Yu Shen, Marvin Zelen;1999;;
Missed;shen2005_2.pdf;robust modeling in screening studies: estimation of sensitivity and preclinical sojourn time distribution;Yu Shen, Marvin Zelen;2005;;
Missed;simonella2015.pdf;development of a quality framework for models of cervical screening and its application to evaluations of the costeffectiveness of hpv vaccination in developed countries;Leonardo Simonella, Karen Canfell;2014;;
Missed;Tan2000.pdf;estimating parameters of a microsimulation model for breast cancer screening using the score function method;Sita YGL Tan, Gerrit J van Oortmarssen, Nanda Piersma ;2000;;
Missed;Taylor2000.pdf;Cost-effectiveness of the conventional papanicolaou test with a new adjunct to cytological screening for squamous cell carcinoma of the uterine cervix and its precursors.;Taylor LA, Sorensen SV, Ray NF, Halpern MT, Harper DM;2000;;
Missed;Thomas2017.pdf;Estimating the Effect of Targeted Screening Strategies An Application to Colonoscopy and Colorectal Cancer;Thomas, Duncan C;2017;;
Missed;vervoort2004.pdf;Trends in the usage of adjuvant systemic therapy for breast cancer in the Netherlands and its effect on mortality.;Vervoort MM, Draisma G, Fracheboud J, van de Poll-Franse LV, de Koning HJ;2004;;
Missed;vogelaar2006.pdf;How much can current interventions reduce colorectal cancer mortality in the US? Mortality projections for scenarios of risk-factor modification, screening, and treatment;Vogelaar Iris, van Ballegooijen Marjolein, Schrag Deborah, Boer Rob, Winawer Sidney J, Habbema J Dik F, Zauber Ann G;2006;;
Missed;whynes1999_2.pdf;Cost-effectiveness of faecal occult blood screening for colorectal cancer: results of the Nottingham trial.;David K Whynes;1999;;
Missed;wu2009_3.pdf;Evaluation of breast cancer service screening programme with a Bayesian approach: mortality analysis in a Finnish region.;Jenny Chia-Yun Wu, Ahti Anttila, Amy Ming-Fang Yen, Matti Hakama, Irma Saarenmaa, Tytti Sarkeala, Nea Malila, Anssi Auvinen, Sherry Yueh-Hsia Chiu, Tony Hsiu-Hsi Chen;2010;;
 <1998;;Are increases in mammographic screening still a valid explanation for trends in breast cancer incidence in the United States?; Wun L.-M., Feuer E.J., Miller B.A. ;1980;;
 <1998;;Screening women aged 40-49 years: where are we today?;Comment,Editorial,Adult,Age Factors,American Cancer Society,Breast Neoplasms/diagnosis,Breast Neoplasms/mortality*,Breast Neoplasms/prevention & control*,Computer Simulation,Female,Humans,Mammography*,Mass Screening*,Middle Aged,National Institutes of Health (U.S.),Population Surveillance,Sweden,United States;1995;;
 double;;Cost-effectiveness analysis for breast cancer screening: double reading versus single plus CAD reading;Sato, Miho  Kawai, Masaaki  Nishino, Yoshikazu  Shibuya, Daisuke  Ohuchi, Noriaki  Ishibashi, Tadashi;2014;;
 double;;Cost-effectiveness of using human papillomavirus cancer screening;Vijayaraghavan, Arthi, Efrusy, Molly B., Goodman, Karyn A., Santas, Christopher C., Huh, Warner K.;2010;;
 double;;Estimation of the tumor size at cure threshold among aggressive non-small cell lung cancers (NSCLCs): evidence from the surveillance, epidemiology, and end results (SEER) program and the national lung screening trial (NLST);Goldwasser, Deborah L.;2017;;
 double;;Evaluation of a selective screening for colorectal carcinoma - The Taiwan Multicenter Cancer Screening (TAMCAS) project;Chen, THH  Yen, MF  Lai, MS  Koong, SL  Wang, CY  Wong, JM  Prevost, TC  Duffy, SW;1999;;
 double;;Predicting the change in breast cancer deaths in Spain by 2019: a Bayesian approach.;Cl?ries R1, Mart??nez JM, Moreno V, Yasui Y, Ribes J, Borr?s JM.;2013;;
 double;;Simulation modeling for stratified breast cancer screening - a systematic review of cost and quality of life assumptions;Arnold, Matthias;2017;;
 double;;SYSTEMATIC REVIEW OF MARKOV MODEL-BASED ECONOMIC EVALUATION STUDIES FOR CERVICAL CANCER SCREENING STRATEGIES: LATIN AMERICA COUNTRIES PANORAMA;Viscondi, J. Y.  Faustino, C. G.  Campolina, A. G.  De Soarez, P. C.;2017;;
 double;;The Cost-Effectiveness of Visual Triage of Human Papillomavirus-Positive Women in Three Low- and Middle-Income Countries.;Campos NG1, Jeronimo J2, Tsu V2, Castle PE3,4, Mvundura M5, Kim JJ6.;2017;;
 double;;The value of colonoscopic colorectal cancer screening of adults aged 50 to 64.;Am J Manag Care. 2015 Jul 1.21(7):e430-8.;2013;;
 double;;To screen or not to screen for breast cancer? How do modelling studies answer the question?;Koleva-Kolarova, R. G., Zhan, Z., Greuter, M. J. W., Feenstra, T. L., De Bock, G. H.;2015;;
 double;;comparative effectiveness of alternative prostate-specific antigen based prostate cancer screening strategies: model estimates of potential benefits and harms;;;;
 double;;the effect of fecal occult-blood screening on the incidence of colorectal cancer;;;;
 double;;cost-effectiveness of colonoscopy in screening for colorectal cancer;;;;
 double;;stool dna testing to screen for colorectal cancer in the medicare population: a cost-effectiveness analysis;;;;
 double;;cost-effectiveness of computed tomographic colonography screening for colorectal cancer in the medicare population;;;;
 double;;collaborative modeling of the benefits and harms associated with different u;;;;
 double;;evaluating test strategies for colorectal cancer screening: a decision analysis for the u;;;;
 double;;a simulation model investigating the impact of tumor volume doubling time and mammographic tumor detectability on screening outcomes in women aged 40 e;;;;
 double;;immunochemical and guaiac fecal occult blood tests: a cost-effectiveness analysis;;;;
 double;;estimating mean sojourn time and screening sensitivity using data on time since previous screening;;;;
 For request;;A Markov model for optimal intervals in prostate cancer screening programs in the era of individual baseline PSA values;Kobayashi, T, Goto-Watanabe, R, Ito, K, Mitsumori, K;2005;;
 For request;;Lifetime costs of colon and rectal cancer management in Canada;Maroun J., Ng E., Berthelot J.-M., Le Petit C., Dahrouge S., Flanagan W.M., Walker H., Evans W.K.;2003;;
 For request;;Potential impact of population-based colorectal cancer screening in Canada.;Flanagan WM1, Le Petit C, Berthelot JM, White KJ, Coombs BA, Jones-McLean E.;2003;;
 For request;;Prevention of cervical cancer with screening programme in Branicevo District and cost-effectiveness analysis adjusted to the territory of the Republic of Serbia.;;2009;;
 For request;;Simulation modeling of lung cancer screening cost-effectiveness analysis;Wan, W.;2015;;
 For request;;The Cancer Risk Management Model: A Tool to Inform Canadian Policymakers Implementing Low-Dose CT Screening for Lung Cancer;Evans, William K., Gofffin, John, Flanagan, William, Miller, Anthony, Fitzgerald, Natalie, Memon, Saima, Fung, Sharon, Wolfson, Michael;2015;;
 For request;;The Economic Evaluation of Lung Cancer Screening Using a System Model,; Koinuma N. ;2003;;
 For request;;The economic evaluation of screening for colorectal cancer: Case of Iran.;Clin Lab. 2013.59(5-6):667-74.;2011;;
 For request;;USE OF RELATIVE RISK RATIOS TO PRESENT UNCERTAINTY IN MICROSIMULATION MODELS WITH MULTIPLE COMPARATORS: AN APPLICATION TO BREAST CANCER SCREENING STRATEGIES;Shih, Y. T.  Doug, W.  Xu, Y.  Yu, S.;2017;;
 For request;;Using simulation to assess the effect of cervical cancer screening policies in Taiwan,; Hwang L.-L. ;2007;;
 For request;;Value Of Waiving Coinsurance For Colorectal Cancer Screening In Medicare Beneficiaries.;Peterse EFP1, Meester RGS2, Gini A3, Doubeni CA4, Anderson DS5, Berger FG6, Zauber AG7, Lansdorp-Vogelaar I8.;2017;;
 For request;;What is the best screening strategy to detect advanced colorectal adenomas? Simulation from ongoing Italian screening experiences.;;2011;;
 For request;;flexible sigmoidoscopy screening for colorectal cancer in average-risk people: update of a community-based project;;;;
 For request;;evaluation of a selective screening for colorectal carcinoma: the taiwan multicenter cancer screening (tamcas) project;;;;
 No trace;;economic evaluation and modelling study prepared by ims health pty ltd australia for the australian government department of health and ageing;;;;
 Not a paper;;ACCELERATING DECISION-MAKING WITH MICROSIMULATION: THE ADOPTION OF EVIDENCE IN CERVICAL CANCER SCREENING;Fitzgerald, Natalie R., Asakawa, Keiko, Coldman, Andrew, Evans, William K., Flanagan, William M., Gribble, Steve, Lockwood, Gina, Memon, Saima, Miller, Anthony B., Nadeau, Claude, Popadiuk, Cathy, Wolfson, Michael C.;2014;;
